<?xml version="1.0" ?>
<!-- $Header: /nfs/slac/g/glast/ground/cvs/calibGenCAL/src/CfData.cxx,v 1.7 2006/03/01 21:32:59 fewtrell Exp $  -->
<!-- Made-up  intNonlin XML file for EM, according to calCalib_v2r3.dtd -->

<!DOCTYPE calCalib [
<!--
   $Header: /nfs/slac/g/glast/ground/cvs/calibUtil/xml/calCalib_v2r3.dtd,v 1.1 2005/08/01 04:17:56 jrb Exp $

   /**  @file       calCalib_v2r3.dtd
        @authors    J. Bogart

        dtd for CAL calibration data types

    */

 -->

<!-- 
   Overall structure is some header information followed by
   a sequence of tower data.  Tower data is made up
   of layer data, in turn made up of data for individual
   crystals, which consists of data for (1 or 2, depending
   on calibration type) faces.  

   The header information comes in two parts:
     "generic" is relevant to any sort of calibration data,
               not just that from the CAL, such as the
               name of the instrument being calibrated.
               See further comments above the generic element
               declaration
     "dimension" contains all the parameters necessary to figure 
               out which data goes with which hardware entity.
               See further comments above the dimension element
               declaration
  -->  

<!ELEMENT calCalib (generic, dimension, dac*, xpos?, tower* ) >
       
<!-- Container for all the header/metadata type information to be
     included here.  Complete metadata will be found in the calibration
     MySQL database. 

     Description of attributes:

            instrument    - one of "flight", "EM", etc.  Could also
                            be implemented as enumeration rather than
                            NMTOKEN
            timestamp     - when the file was written (date and time)
            calType       - one of "TKRBadStrips", "CALLightAttenuation",
                            etc.
            formatVersion - sufficient versioning information so that
                            software attempting to read the file can
                            determine if it supports this version. 
                            [Might get rid of this here and just keep
                            it in the MySQL metadata table]
            creator       - script or program creating calibration data
 -->
<!ELEMENT  generic  (inputSample?) >
<!ATTLIST generic  
   instrument  (LAT | BFEM | BTEM | EM | EM2 | CU) #REQUIRED
   timestamp   CDATA #REQUIRED
   calibType (CAL_LightAtt | CAL_LightAsym | CAL_LightYield |
              CAL_Ped | CAL_ElecGain | CAL_IntNonlin | CAL_DiffNonlin |
              CAL_MuSlope | CAL_Asym | CAL_MevPerDac | CAL_TholdCI |
              CAL_TholdMuon)    #REQUIRED
   DTDVersion  NMTOKEN "v2r3"       
   fmtVersion  NMTOKEN #REQUIRED
   creator     CDATA #IMPLIED >

<!-- Description of events used as input to the procedure 
     Start- and stop-times should be timestamps of earliest and
     latest events included in sample.
     inputSample is (for now) optional.
-->
<!ELEMENT inputSample (#PCDATA) >
<!ATTLIST inputSample  startTime CDATA #REQUIRED
                       stopTime  CDATA #REQUIRED
                       triggers  NMTOKENS #REQUIRED 
                       source    NMTOKENS #REQUIRED
                       mode      NMTOKEN  #REQUIRED>

<!-- In many cases calibration is done per range: LEX8 is low-energy 
   (= large) diode, x8 amplification; LEX1 is low-energy, low amplification.
   Similarly have HEX8, HEX1 for high-energy (small) diode.
   Unfortunately can't use parameter entities since they aren't allowed
   when the dtd is literally included in an xml file, something
   we'd like to support.
  -->

<!-- For light asymmetry may lump together amplifications (and by
  definition one set of constants applies to both crystal ends, since
  constants quantify *asymmetry*), so have a set of constants per
  diode-type -->

<!-- Describe how the data is dimensioned:
        number of tower rows
        number of tower columns
        number of calorimeter layers
        number of crystals in a layer ("columns")
        number of faces      (mostly 2; 1 for light asymmetry data)
        number of ranges     (fixed at 4? for now just default to 4) 
        number of sets of dac settings (mostly 0)
        number of xpos elements.  Can only be 0 or 1
        exact    may be "true" or "false".  If "true", above information
                 may be mutliplied to compute total number of innermost
                 elements (e.g., calPed)

   Use the following conventions to determine which data element 
   corresponds to a particular physical crystal, optional face and
   gain range:
       * Tower number is computed from row and column as
                 tower = column + (nCol)*row
       * The data can be viewed as a 5-dimensional array where
         the indices from most- to least-significant are
              tower
              layer
              xtal   (often called "column" in calorimeter code)
              face
              range
         So the first two data elements will correspond to 
           (tower=0,layer=0, xtal=0, face=0, range=0)
           (tower=0,layer=0, xtal=0, face=0, range=1)
 
         The total number of data elements (for the default
         case, with exact = "true") is just
                nRow*nCol*nLayer*nXtal*nFace*nRange

 -->
<!ELEMENT dimension EMPTY>
<!ATTLIST dimension nRow NMTOKEN  #REQUIRED
                    nCol NMTOKEN  #REQUIRED
                    nLayer NMTOKEN #REQUIRED
                    nXtal  NMTOKEN #REQUIRED
                    nFace  NMTOKEN #REQUIRED
                    nRange NMTOKEN "4"      
                    nDacCol NMTOKEN "0" 
                    nXpos  (0 | 1) "0"
                    exact  (true | false) "true" >

<!-- For those calibrations involving setting a dac, keep track of
    settings.  Expect one set per range where used; else 0. Number 
    should match value of dimension attribute nDacCol  -->
<!ELEMENT dac EMPTY>
<!ATTLIST dac range (LEX8 | LEX1 | HEX8 | HEX1) #REQUIRED
          values NMTOKENS #REQUIRED
          error  NMTOKEN  #IMPLIED >   <!-- for now.  May want default -->

<!ELEMENT xpos EMPTY>
<!ATTLIST xpos values NMTOKENS #REQUIRED>

<!ELEMENT tower (layer*) >
<!ATTLIST tower iRow NMTOKEN #REQUIRED
                iCol NMTOKEN #REQUIRED 
                hwserial NMTOKEN "-1" >

<!ELEMENT layer (xtal*) >
<!ATTLIST layer iLayer NMTOKEN #REQUIRED>

<!ELEMENT xtal (face, face?) >
<!ATTLIST xtal iXtal NMTOKEN #REQUIRED>

<!-- each face has data for all four ranges, ordered by range number -->
<!ELEMENT face (calPed* | calGain* | muSlope* | lightAsym* | intNonlin*
                        | mevPerDac* | tholdCI* | tholdMuon*
                        | asym* ) >
<!ATTLIST face end (NEG | POS | NA) #REQUIRED >


<!ELEMENT calPed  EMPTY>
<!ATTLIST calPed  range (LEX8 | LEX1 | HEX8 | HEX1) #REQUIRED
                  avg NMTOKEN #REQUIRED
                  sig NMTOKEN #REQUIRED
                  cos NMTOKEN "2" >

<!ELEMENT calGain EMPTY>
<!ATTLIST calGain range (LEX8 | LEX1 | HEX8 | HEX1) #REQUIRED
                  avg NMTOKEN #REQUIRED
                  sig NMTOKEN #REQUIRED>

<!ELEMENT muSlope EMPTY>
<!ATTLIST muSlope range (LEX8 | LEX1 | HEX8 | HEX1) #REQUIRED
                  slope NMTOKEN #REQUIRED
                  error NMTOKEN "0.0" >

<!ELEMENT lightAsym EMPTY>
<!ATTLIST lightAsym diode (LE | HE) #REQUIRED
                    values NMTOKENS #REQUIRED
                    error NMTOKEN #REQUIRED >

<!ELEMENT intNonlin EMPTY>
<!ATTLIST intNonlin range (LEX8 | LEX1 | HEX8 | HEX1) #REQUIRED
                    values NMTOKENS #REQUIRED
                    sdacs NMTOKENS  #IMPLIED
                    error NMTOKEN   #REQUIRED >

<!-- Some of mevPerDac information is per-crystal, some is per face.  So
     <mevPerDac> is identified by tower/layer/crystal and contains two
     <bigSmall> elements for the per-face information. 
 -->
<!ELEMENT mevPerDac (bigSmall, bigSmall) >
<!ATTLIST mevPerDac bigVal NMTOKEN #REQUIRED
                    bigSig NMTOKEN #REQUIRED
                    smallVal NMTOKEN #REQUIRED
                    smallSig NMTOKEN #REQUIRED
>
<!ELEMENT bigSmall EMPTY>
<!ATTLIST bigSmall  end (NEG | POS) #REQUIRED
                    bigSmallRatioVals NMTOKENS #REQUIRED
                    bigSmallRatioSigs NMTOKENS #REQUIRED
>

<!ELEMENT asym EMPTY>
<!ATTLIST asym bigVals NMTOKENS #REQUIRED
               bigSigs NMTOKENS #REQUIRED
               smallVals  NMTOKENS #REQUIRED
               smallSigs  NMTOKENS #REQUIRED
               NsmallPbigVals NMTOKENS #REQUIRED
               NsmallPbigSigs NMTOKENS #REQUIRED
               PsmallNbigVals NMTOKENS #REQUIRED
               PsmallNbigSigs NMTOKENS #REQUIRED
>

<!-- Some of tholdCI information is per-crystal-face, some is per range.  So
     <tholdCI> is identified by tower/layer/crystal/face and contains up
       to 4 tholdCIRange elements for per-range information
 -->
<!ELEMENT tholdCI (tholdCIRange, tholdCIRange?, tholdCIRange?, tholdCIRange?) >
<!ATTLIST tholdCI FLEVal NMTOKEN #REQUIRED
                  FLESig NMTOKEN #REQUIRED
                  FHEVal NMTOKEN #REQUIRED
                  FHESig NMTOKEN #REQUIRED
                  LACVal NMTOKEN #REQUIRED
                  LACSig NMTOKEN #REQUIRED
>

<!ELEMENT tholdCIRange EMPTY>
<!ATTLIST tholdCIRange range (LEX8 | LEX1 | HEX8 | HEX1) #REQUIRED
                       pedVal NMTOKEN #REQUIRED
                       pedSig NMTOKEN #REQUIRED
                       ULDVal NMTOKEN #REQUIRED
                       ULDSig NMTOKEN #REQUIRED
>

<!-- Some of tholdMuon information is per-crystal-face, some is per range.  So
     <tholdMuon> is identified by tower/layer/crystal/face and contains up
       to 4 tholdMuonRange elements for per-range information
 -->
<!ELEMENT tholdMuon (tholdMuonRange, tholdMuonRange?, tholdMuonRange?, 
                     tholdMuonRange?) >
<!ATTLIST tholdMuon FLEVal NMTOKEN #REQUIRED
                    FLESig NMTOKEN #REQUIRED
                    FHEVal NMTOKEN #REQUIRED
                    FHESig NMTOKEN #REQUIRED >

<!ELEMENT tholdMuonRange EMPTY>
<!ATTLIST tholdMuonRange range (LEX8 | LEX1 | HEX8 | HEX1) #REQUIRED
                         pedVal NMTOKEN #REQUIRED
                         pedSig NMTOKEN #REQUIRED
>

] >

<calCalib>
  <generic instrument="LAT" timestamp="2000-1-1-00:00"
           calibType="CAL_IntNonlin" fmtVersion="v2r3" >

  </generic>

<!-- EM instrument: 8 layers, 12 columns -->

<!-- number of collections of dac settings should normally be
     0 (the default), if dacs aren't used to acquire data, or 
     equal to nRange -->
 <dimension nRow="4" nCol="4" nLayer="8" nXtal="12" nFace="2" nRange="4"
           nDacCol="0" />

 <tower iRow="0" iCol="1">
  <layer iLayer="0">
   <xtal iXtal="0">
    <face end="POS">
     <intNonlin range="LEX8"
             values="0.00 23.38 44.50 112.03 180.04 247.30 316.20 385.08 453.00 522.02 592.44 659.80 729.28 1283.89 1843.68 2408.34 2599.06 2788.50 2981.86 3174.10 3366.36 3555.60 3716.10 "
             sdacs="0.00 2.00 4.00 10.00 16.00 22.00 28.00 34.00 40.00 46.00 52.00 58.00 64.00 112.00 160.00 208.00 224.00 240.00 256.00 272.00 288.00 304.00 317.57 "
             error="0.10" />
     <intNonlin range="LEX1"
             values="0.00 10.05 20.06 30.09 40.26 50.27 60.57 70.68 80.88 163.03 246.19 330.82 416.11 501.92 588.32 675.24 848.30 1025.81 1205.65 1387.36 1570.44 1753.91 1938.03 2122.65 2307.15 2491.86 2676.61 2861.25 3045.86 3230.34 3414.80 3461.06 3507.00 3553.00 3599.20 3645.40 3691.70 3737.48 3783.52 3829.38 3890.96 "
             sdacs="0.00 8.00 16.00 24.00 32.00 40.00 48.00 56.00 64.00 128.00 192.00 256.00 320.00 384.00 448.00 512.00 639.00 767.00 895.00 1023.00 1151.00 1279.00 1407.00 1535.00 1663.00 1791.00 1919.00 2047.00 2175.00 2303.00 2431.00 2463.00 2495.00 2527.00 2559.00 2591.00 2623.00 2655.00 2687.00 2719.00 2761.97 "
             error="0.10" />
     <intNonlin range="HEX8"
             values="0.00 24.24 47.54 115.95 185.81 255.04 325.36 395.31 465.45 534.70 605.12 675.49 745.55 1311.57 1880.18 2452.98 2646.04 2838.00 3032.00 3225.12 3418.66 3580.82 "
             sdacs="0.00 2.00 4.00 10.00 16.00 22.00 28.00 34.00 40.00 46.00 52.00 58.00 64.00 112.00 160.00 208.00 224.00 240.00 256.00 272.00 288.00 301.41 "
             error="0.10" />
     <intNonlin range="HEX1"
             values="0.00 10.41 20.72 30.92 41.34 51.75 62.08 72.49 82.95 166.93 251.64 337.53 423.55 509.92 596.50 683.56 855.81 1031.52 1208.57 1386.19 1564.02 1742.22 1920.50 2098.84 2277.30 2455.64 2634.02 2812.33 2990.40 3168.59 3346.94 3391.40 3436.40 3481.20 3526.26 3571.58 3617.32 3662.44 3707.32 3751.24 3795.66 3866.12 "
             sdacs="0.00 8.00 16.00 24.00 32.00 40.00 48.00 56.00 64.00 128.00 192.00 256.00 320.00 384.00 448.00 512.00 639.00 767.00 895.00 1023.00 1151.00 1279.00 1407.00 1535.00 1663.00 1791.00 1919.00 2047.00 2175.00 2303.00 2431.00 2463.00 2495.00 2527.00 2559.00 2591.00 2623.00 2655.00 2687.00 2719.00 2751.00 2801.76 "
             error="0.10" />
    </face>
    <face end="NEG">
     <intNonlin range="LEX8"
             values="0.00 21.44 44.48 114.65 184.44 255.63 324.64 395.66 466.81 537.23 608.11 679.00 750.96 1320.98 1897.47 2285.10 2478.26 2671.38 2870.52 3067.36 3265.70 3419.80 "
             sdacs="0.00 2.00 4.00 10.00 16.00 22.00 28.00 34.00 40.00 46.00 52.00 58.00 64.00 112.00 160.00 192.00 208.00 224.00 240.00 256.00 272.00 284.43 "
             error="0.10" />
     <intNonlin range="LEX1"
             values="0.00 10.17 20.53 30.88 41.31 51.76 62.24 72.82 83.44 168.44 254.54 341.81 430.08 518.55 607.59 697.00 875.01 1057.23 1240.79 1424.72 1609.21 1793.85 1978.70 2163.53 2348.37 2533.53 2718.33 2903.34 3088.23 3273.01 3411.70 3457.76 3503.94 3549.86 3596.26 3642.38 3688.80 3734.96 3781.10 3827.10 3869.46 "
             sdacs="0.00 8.00 16.00 24.00 32.00 40.00 48.00 56.00 64.00 128.00 192.00 256.00 320.00 384.00 448.00 512.00 639.00 767.00 895.00 1023.00 1151.00 1279.00 1407.00 1535.00 1663.00 1791.00 1919.00 2047.00 2175.00 2303.00 2399.00 2431.00 2463.00 2495.00 2527.00 2559.00 2591.00 2623.00 2655.00 2687.00 2716.47 "
             error="0.10" />
     <intNonlin range="HEX8"
             values="0.00 23.64 46.02 116.85 187.42 259.14 329.78 401.76 471.18 543.57 614.51 686.38 757.73 1332.24 1911.10 2493.32 2689.06 2884.22 3081.00 3277.66 3472.44 3684.82 "
             sdacs="0.00 2.00 4.00 10.00 16.00 22.00 28.00 34.00 40.00 46.00 52.00 58.00 64.00 112.00 160.00 208.00 224.00 240.00 256.00 272.00 288.00 305.45 "
             error="0.10" />
     <intNonlin range="HEX1"
             values="0.00 10.43 20.94 31.57 42.12 52.65 63.29 74.00 84.69 170.32 256.84 344.24 431.93 519.88 608.07 696.42 871.42 1049.76 1228.43 1407.32 1586.31 1765.43 1944.59 2123.73 2302.74 2481.80 2660.92 2839.84 3018.72 3197.98 3379.36 3425.18 3470.24 3514.64 3559.14 3604.04 3648.76 3693.46 3738.08 3782.76 3858.22 "
             sdacs="0.00 8.00 16.00 24.00 32.00 40.00 48.00 56.00 64.00 128.00 192.00 256.00 320.00 384.00 448.00 512.00 639.00 767.00 895.00 1023.00 1151.00 1279.00 1407.00 1535.00 1663.00 1791.00 1919.00 2047.00 2175.00 2303.00 2431.00 2463.00 2495.00 2527.00 2559.00 2591.00 2623.00 2655.00 2687.00 2719.00 2773.04 "
             error="0.10" />
    </face>
   </xtal>
   <xtal iXtal="1">
    <face end="POS">
     <intNonlin range="LEX8"
             values="0.00 23.42 43.14 113.19 180.62 249.13 318.28 387.53 457.68 526.38 595.94 663.80 734.60 1293.87 1858.00 2429.56 2619.24 2811.37 3006.02 3200.34 3393.12 3608.80 "
             sdacs="0.00 2.00 4.00 10.00 16.00 22.00 28.00 34.00 40.00 46.00 52.00 58.00 64.00 112.00 160.00 208.00 224.00 240.00 256.00 272.00 288.00 305.90 "
             error="0.10" />
     <intNonlin range="LEX1"
             values="0.00 10.06 20.12 30.37 40.50 50.84 61.15 71.37 81.76 165.09 249.43 335.10 421.64 508.66 596.16 684.33 859.80 1039.55 1221.12 1404.27 1587.80 1771.55 1955.50 2139.91 2324.25 2508.30 2692.53 2876.61 3060.59 3244.64 3428.22 3474.38 3520.04 3566.28 3611.96 3657.72 3703.50 3749.34 3794.94 3840.84 3881.36 "
             sdacs="0.00 8.00 16.00 24.00 32.00 40.00 48.00 56.00 64.00 128.00 192.00 256.00 320.00 384.00 448.00 512.00 639.00 767.00 895.00 1023.00 1151.00 1279.00 1407.00 1535.00 1663.00 1791.00 1919.00 2047.00 2175.00 2303.00 2431.00 2463.00 2495.00 2527.00 2559.00 2591.00 2623.00 2655.00 2687.00 2719.00 2747.25 "
             error="0.10" />
     <intNonlin range="HEX8"
             values="0.00 23.22 46.34 115.95 186.02 256.06 326.97 396.89 466.19 537.17 607.54 678.85 749.05 1317.19 1887.94 2270.84 2463.90 2657.00 2851.26 3044.94 3239.76 3343.00 "
             sdacs="0.00 2.00 4.00 10.00 16.00 22.00 28.00 34.00 40.00 46.00 52.00 58.00 64.00 112.00 160.00 192.00 208.00 224.00 240.00 256.00 272.00 280.48 "
             error="0.10" />
     <intNonlin range="HEX1"
             values="0.00 10.54 20.93 31.33 41.84 52.25 62.73 73.22 83.76 168.56 253.94 340.56 427.25 514.42 601.65 689.18 862.57 1039.31 1216.88 1394.88 1572.79 1751.11 1929.34 2107.43 2285.87 2463.89 2642.06 2820.16 2998.00 3175.88 3354.85 3399.72 3445.44 3490.74 3535.40 3579.56 3624.00 3668.18 3712.44 3756.52 3801.14 3874.56 "
             sdacs="0.00 8.00 16.00 24.00 32.00 40.00 48.00 56.00 64.00 128.00 192.00 256.00 320.00 384.00 448.00 512.00 639.00 767.00 895.00 1023.00 1151.00 1279.00 1407.00 1535.00 1663.00 1791.00 1919.00 2047.00 2175.00 2303.00 2431.00 2463.00 2495.00 2527.00 2559.00 2591.00 2623.00 2655.00 2687.00 2719.00 2751.00 2803.65 "
             error="0.10" />
    </face>
    <face end="NEG">
     <intNonlin range="LEX8"
             values="0.00 20.72 44.62 112.26 181.14 249.33 318.62 387.71 456.56 527.14 596.86 665.40 735.41 1296.02 1861.40 2431.89 2623.92 2818.52 3012.06 3205.08 3399.78 3592.62 3649.20 "
             sdacs="0.00 2.00 4.00 10.00 16.00 22.00 28.00 34.00 40.00 46.00 52.00 58.00 64.00 112.00 160.00 208.00 224.00 240.00 256.00 272.00 288.00 304.00 308.69 "
             error="0.10" />
     <intNonlin range="LEX1"
             values="0.00 9.88 20.06 30.21 40.40 50.56 60.88 71.02 81.35 164.40 248.49 334.07 420.14 506.85 594.14 681.72 856.42 1035.65 1216.60 1398.98 1582.59 1766.51 1950.78 2135.35 2319.92 2504.50 2689.32 2873.85 3058.48 3242.95 3427.24 3473.48 3519.76 3565.82 3611.60 3657.66 3703.84 3749.82 3795.46 3841.50 3900.76 "
             sdacs="0.00 8.00 16.00 24.00 32.00 40.00 48.00 56.00 64.00 128.00 192.00 256.00 320.00 384.00 448.00 512.00 639.00 767.00 895.00 1023.00 1151.00 1279.00 1407.00 1535.00 1663.00 1791.00 1919.00 2047.00 2175.00 2303.00 2431.00 2463.00 2495.00 2527.00 2559.00 2591.00 2623.00 2655.00 2687.00 2719.00 2760.19 "
             error="0.10" />
     <intNonlin range="HEX8"
             values="0.00 22.40 44.84 115.95 185.64 256.03 326.74 396.86 467.14 538.34 608.98 679.44 750.19 1318.99 1891.09 2274.96 2466.74 2657.86 2852.74 3047.68 3239.61 3458.34 "
             sdacs="0.00 2.00 4.00 10.00 16.00 22.00 28.00 34.00 40.00 46.00 52.00 58.00 64.00 112.00 160.00 192.00 208.00 224.00 240.00 256.00 272.00 290.23 "
             error="0.10" />
     <intNonlin range="HEX1"
             values="0.00 10.17 20.49 30.92 41.34 51.70 62.22 72.61 83.11 167.48 252.60 338.58 425.25 512.08 598.96 686.21 859.19 1035.58 1212.91 1390.51 1568.53 1746.69 1924.98 2103.32 2281.60 2459.87 2638.03 2816.26 2994.36 3172.47 3353.22 3443.56 3487.70 3531.96 3576.44 3620.82 3665.24 3709.52 3753.80 3797.95 3842.26 3897.46 "
             sdacs="0.00 8.00 16.00 24.00 32.00 40.00 48.00 56.00 64.00 128.00 192.00 256.00 320.00 384.00 448.00 512.00 639.00 767.00 895.00 1023.00 1151.00 1279.00 1407.00 1535.00 1663.00 1791.00 1919.00 2047.00 2175.00 2303.00 2431.00 2495.00 2527.00 2559.00 2591.00 2623.00 2655.00 2687.00 2719.00 2751.00 2783.00 2822.86 "
             error="0.10" />
    </face>
   </xtal>
   <xtal iXtal="2">
    <face end="POS">
     <intNonlin range="LEX8"
             values="0.00 22.84 46.86 114.38 184.41 254.18 322.91 392.63 462.63 532.30 602.37 672.06 742.89 1308.90 1881.02 2456.90 2650.94 2846.18 3040.48 3237.60 3433.96 3574.98 "
             sdacs="0.00 2.00 4.00 10.00 16.00 22.00 28.00 34.00 40.00 46.00 52.00 58.00 64.00 112.00 160.00 208.00 224.00 240.00 256.00 272.00 288.00 299.49 "
             error="0.10" />
     <intNonlin range="LEX1"
             values="0.00 10.17 20.50 30.87 41.10 51.41 61.75 72.17 82.69 167.02 252.39 339.10 426.81 514.98 603.71 692.72 870.04 1051.55 1234.88 1418.19 1602.19 1786.46 1970.97 2155.50 2340.11 2524.48 2708.89 2893.32 3077.76 3262.08 3400.28 3446.24 3492.14 3538.16 3584.30 3630.44 3676.48 3722.64 3768.52 3814.40 3885.20 "
             sdacs="0.00 8.00 16.00 24.00 32.00 40.00 48.00 56.00 64.00 128.00 192.00 256.00 320.00 384.00 448.00 512.00 639.00 767.00 895.00 1023.00 1151.00 1279.00 1407.00 1535.00 1663.00 1791.00 1919.00 2047.00 2175.00 2303.00 2399.00 2431.00 2463.00 2495.00 2527.00 2559.00 2591.00 2623.00 2655.00 2687.00 2736.37 "
             error="0.10" />
     <intNonlin range="HEX8"
             values="0.00 24.14 46.88 118.01 188.21 259.94 328.80 400.16 470.94 542.63 613.34 683.57 755.54 1327.70 1903.07 2288.96 2480.14 2676.34 2872.08 3067.68 3264.18 3466.36 "
             sdacs="0.00 2.00 4.00 10.00 16.00 22.00 28.00 34.00 40.00 46.00 52.00 58.00 64.00 112.00 160.00 192.00 208.00 224.00 240.00 256.00 272.00 288.46 "
             error="0.10" />
     <intNonlin range="HEX1"
             values="0.00 10.53 20.95 31.50 41.80 52.44 63.08 73.45 84.14 169.46 255.49 342.49 429.85 517.34 605.10 693.08 867.18 1044.65 1222.65 1400.81 1579.22 1757.56 1936.07 2114.59 2292.92 2471.36 2649.75 2827.95 3006.19 3184.47 3363.64 3408.92 3454.56 3499.70 3544.48 3588.86 3633.22 3677.57 3722.28 3766.52 3810.78 3870.92 "
             sdacs="0.00 8.00 16.00 24.00 32.00 40.00 48.00 56.00 64.00 128.00 192.00 256.00 320.00 384.00 448.00 512.00 639.00 767.00 895.00 1023.00 1151.00 1279.00 1407.00 1535.00 1663.00 1791.00 1919.00 2047.00 2175.00 2303.00 2431.00 2463.00 2495.00 2527.00 2559.00 2591.00 2623.00 2655.00 2687.00 2719.00 2751.00 2794.48 "
             error="0.10" />
    </face>
    <face end="NEG">
     <intNonlin range="LEX8"
             values="0.00 23.32 44.70 115.24 184.39 255.39 326.12 395.88 465.60 536.68 606.96 679.23 748.95 1317.77 1890.56 2471.05 2669.16 2864.90 3059.46 3255.59 3453.80 3571.42 "
             sdacs="0.00 2.00 4.00 10.00 16.00 22.00 28.00 34.00 40.00 46.00 52.00 58.00 64.00 112.00 160.00 208.00 224.00 240.00 256.00 272.00 288.00 297.49 "
             error="0.10" />
     <intNonlin range="LEX1"
             values="0.00 10.18 20.45 30.84 41.19 51.49 61.94 72.43 82.92 167.16 252.39 339.15 426.46 514.14 602.40 691.09 867.74 1048.76 1231.66 1415.74 1600.36 1785.65 1970.79 2156.01 2341.34 2526.77 2712.11 2897.42 3082.53 3267.55 3406.20 3452.44 3498.78 3544.86 3590.94 3637.26 3683.36 3729.44 3775.48 3821.50 3866.44 "
             sdacs="0.00 8.00 16.00 24.00 32.00 40.00 48.00 56.00 64.00 128.00 192.00 256.00 320.00 384.00 448.00 512.00 639.00 767.00 895.00 1023.00 1151.00 1279.00 1407.00 1535.00 1663.00 1791.00 1919.00 2047.00 2175.00 2303.00 2399.00 2431.00 2463.00 2495.00 2527.00 2559.00 2591.00 2623.00 2655.00 2687.00 2718.25 "
             error="0.10" />
     <intNonlin range="HEX8"
             values="0.00 23.24 45.98 116.84 188.29 259.65 329.83 401.30 472.04 542.67 615.60 686.40 757.76 1331.84 1911.03 2301.48 2497.40 2691.36 2887.60 3082.82 3278.78 3445.96 "
             sdacs="0.00 2.00 4.00 10.00 16.00 22.00 28.00 34.00 40.00 46.00 52.00 58.00 64.00 112.00 160.00 192.00 208.00 224.00 240.00 256.00 272.00 285.65 "
             error="0.10" />
     <intNonlin range="HEX1"
             values="0.00 10.29 20.82 31.33 41.78 52.28 62.85 73.48 84.04 169.28 255.53 342.37 429.37 516.72 604.30 692.05 866.05 1043.40 1221.56 1399.97 1578.35 1757.12 1935.94 2114.75 2293.48 2472.40 2651.01 2829.82 3008.44 3186.91 3368.22 3414.08 3458.76 3503.30 3548.02 3592.60 3636.98 3681.42 3725.90 3770.30 3814.84 3864.90 "
             sdacs="0.00 8.00 16.00 24.00 32.00 40.00 48.00 56.00 64.00 128.00 192.00 256.00 320.00 384.00 448.00 512.00 639.00 767.00 895.00 1023.00 1151.00 1279.00 1407.00 1535.00 1663.00 1791.00 1919.00 2047.00 2175.00 2303.00 2431.00 2463.00 2495.00 2527.00 2559.00 2591.00 2623.00 2655.00 2687.00 2719.00 2751.00 2786.97 "
             error="0.10" />
    </face>
   </xtal>
   <xtal iXtal="3">
    <face end="POS">
     <intNonlin range="LEX8"
             values="0.00 24.00 47.34 117.13 186.65 256.36 326.52 397.12 467.54 537.90 608.05 679.39 750.39 1319.54 1894.13 2279.50 2473.94 2667.92 2867.26 3062.43 3259.50 3484.92 "
             sdacs="0.00 2.00 4.00 10.00 16.00 22.00 28.00 34.00 40.00 46.00 52.00 58.00 64.00 112.00 160.00 192.00 208.00 224.00 240.00 256.00 272.00 290.30 "
             error="0.10" />
     <intNonlin range="LEX1"
             values="0.00 10.39 20.79 31.14 41.57 52.12 62.54 73.08 83.61 168.36 254.31 341.66 429.77 518.38 607.38 696.78 874.98 1057.55 1241.89 1426.97 1612.39 1798.03 1983.87 2169.78 2355.91 2541.75 2727.61 2913.33 3099.01 3284.58 3377.50 3423.92 3470.26 3516.52 3562.90 3609.16 3655.78 3702.12 3748.66 3794.74 3861.46 "
             sdacs="0.00 8.00 16.00 24.00 32.00 40.00 48.00 56.00 64.00 128.00 192.00 256.00 320.00 384.00 448.00 512.00 639.00 767.00 895.00 1023.00 1151.00 1279.00 1407.00 1535.00 1663.00 1791.00 1919.00 2047.00 2175.00 2303.00 2367.00 2399.00 2431.00 2463.00 2495.00 2527.00 2559.00 2591.00 2623.00 2655.00 2701.33 "
             error="0.10" />
     <intNonlin range="HEX8"
             values="0.00 24.28 47.48 118.25 189.28 259.75 330.38 401.47 471.80 543.09 614.35 685.87 757.16 1331.10 1907.40 2293.70 2489.20 2685.30 2880.80 3077.86 3272.96 3325.96 "
             sdacs="0.00 2.00 4.00 10.00 16.00 22.00 28.00 34.00 40.00 46.00 52.00 58.00 64.00 112.00 160.00 192.00 208.00 224.00 240.00 256.00 272.00 276.35 "
             error="0.10" />
     <intNonlin range="HEX1"
             values="0.00 10.67 21.11 31.62 42.11 52.65 63.31 73.84 84.49 169.87 256.07 343.46 430.76 518.56 606.52 694.56 869.19 1047.26 1225.54 1404.20 1582.94 1761.65 1940.45 2119.08 2298.00 2476.67 2655.44 2833.87 3012.40 3190.79 3369.65 3414.40 3459.82 3504.94 3550.40 3596.00 3640.60 3684.52 3729.22 3773.36 3817.76 3860.92 "
             sdacs="0.00 8.00 16.00 24.00 32.00 40.00 48.00 56.00 64.00 128.00 192.00 256.00 320.00 384.00 448.00 512.00 639.00 767.00 895.00 1023.00 1151.00 1279.00 1407.00 1535.00 1663.00 1791.00 1919.00 2047.00 2175.00 2303.00 2431.00 2463.00 2495.00 2527.00 2559.00 2591.00 2623.00 2655.00 2687.00 2719.00 2751.00 2782.11 "
             error="0.10" />
    </face>
    <face end="NEG">
     <intNonlin range="LEX8"
             values="0.00 22.82 45.86 114.05 184.58 253.44 323.80 394.09 464.62 535.37 604.88 674.36 745.78 1313.71 1887.81 2270.40 2463.92 2658.52 2854.84 3051.98 3248.38 3469.56 "
             sdacs="0.00 2.00 4.00 10.00 16.00 22.00 28.00 34.00 40.00 46.00 52.00 58.00 64.00 112.00 160.00 192.00 208.00 224.00 240.00 256.00 272.00 290.02 "
             error="0.10" />
     <intNonlin range="LEX1"
             values="0.00 10.11 20.54 30.74 41.10 51.55 61.95 72.23 82.74 167.16 252.41 339.14 426.72 514.64 603.00 691.83 869.01 1050.65 1233.83 1418.62 1603.70 1789.23 1974.77 2160.48 2346.41 2532.06 2717.73 2903.38 3088.84 3274.34 3413.42 3459.40 3506.00 3552.10 3598.30 3644.54 3691.06 3737.28 3783.52 3829.53 3876.02 "
             sdacs="0.00 8.00 16.00 24.00 32.00 40.00 48.00 56.00 64.00 128.00 192.00 256.00 320.00 384.00 448.00 512.00 639.00 767.00 895.00 1023.00 1151.00 1279.00 1407.00 1535.00 1663.00 1791.00 1919.00 2047.00 2175.00 2303.00 2399.00 2431.00 2463.00 2495.00 2527.00 2559.00 2591.00 2623.00 2655.00 2687.00 2719.33 "
             error="0.10" />
     <intNonlin range="HEX8"
             values="0.00 21.41 45.19 115.73 185.91 256.81 327.74 398.84 469.91 540.95 611.95 683.87 755.45 1329.81 1907.40 2488.63 2684.63 2879.81 3076.63 3271.81 3467.81 3632.71 "
             sdacs="0.00 2.00 4.00 10.00 16.00 22.00 28.00 34.00 40.00 46.00 52.00 58.00 64.00 112.00 160.00 208.00 224.00 240.00 256.00 272.00 288.00 301.46 "
             error="0.10" />
     <intNonlin range="HEX1"
             values="0.00 10.38 20.81 31.31 41.76 52.22 62.79 73.39 84.01 169.37 255.36 342.40 429.70 517.27 604.97 692.95 867.39 1044.99 1223.62 1402.04 1580.78 1759.75 1938.78 2117.70 2296.64 2475.56 2654.44 2833.16 3011.99 3190.60 3369.51 3414.30 3459.80 3505.00 3550.58 3596.16 3640.14 3684.54 3729.16 3773.62 3817.98 3876.88 "
             sdacs="0.00 8.00 16.00 24.00 32.00 40.00 48.00 56.00 64.00 128.00 192.00 256.00 320.00 384.00 448.00 512.00 639.00 767.00 895.00 1023.00 1151.00 1279.00 1407.00 1535.00 1663.00 1791.00 1919.00 2047.00 2175.00 2303.00 2431.00 2463.00 2495.00 2527.00 2559.00 2591.00 2623.00 2655.00 2687.00 2719.00 2751.00 2793.49 "
             error="0.10" />
    </face>
   </xtal>
   <xtal iXtal="4">
    <face end="POS">
     <intNonlin range="LEX8"
             values="0.00 23.10 44.36 112.87 181.86 250.62 320.78 389.17 458.78 529.14 597.25 666.67 736.94 1299.15 1866.14 2437.13 2629.44 2822.44 3016.94 3210.74 3408.25 3603.18 3661.52 "
             sdacs="0.00 2.00 4.00 10.00 16.00 22.00 28.00 34.00 40.00 46.00 52.00 58.00 64.00 112.00 160.00 208.00 224.00 240.00 256.00 272.00 288.00 304.00 308.79 "
             error="0.10" />
     <intNonlin range="LEX1"
             values="0.00 10.02 20.19 30.39 40.70 50.90 61.18 71.38 81.80 165.18 249.37 335.06 421.76 508.72 596.29 684.42 859.66 1039.40 1221.30 1404.34 1588.39 1772.55 1956.87 2141.48 2326.31 2511.09 2695.83 2880.41 3065.02 3249.59 3388.08 3434.12 3480.30 3526.28 3572.26 3618.30 3664.38 3710.52 3756.60 3802.48 3877.24 "